"","GSPAR_IDS","ALTAR_ID","REPORT_YEAR","BASIN_NAME","SUBBASIN_NUMBER","SINGLE_MULTIPLE_AR","ANNUAL_REPORT_AREA","METHOD_USED","TOTAL_WATER_USE","WST_EXPLANATION","WST_GROUNDWATER","WST_OTHER","WST_RECYCLED_WATER","WST_REUSED_WATER","WST_SURFACE_WATER","WUS_AGRICULTURAL","WUS_EXPLANATION","WUS_INDUSTRIAL","WUS_MANAGED_RECHARGE","WUS_MANAGED_WETLANDS","WUS_NATIVE_VEGETATION","WUS_OTHER","WUS_URBAN","sum_used_up","total_water_and_other","total"
"73","",120,2020,"SANTA CLARA","2-009.02","Single Annual Report","Entire Basin","Metered (most use) or estimated using table of average uses or crop factors (estimated groundwater use). Note - Industrial use for all water sources except recycled water is grouped with municipal use under Urban water use sector. The distribution of 14600 AF of recycled water in the various water use sectors is based on the distribution ratio from 2020 data. ",257200,"",89900,0,14600,0,152700,3370,"",6103,59415,0,0,0,247727,257200,257200,0
"74","45",NA,2020,"SANTA CRUZ MID-COUNTY","3-001","Single Annual Report","Entire Basin","Municipal groundwater use is metered. Soquel Creek WD surface water use is metered. City of Santa Cruz surface water use is estimated based on total City of Santa Cruz metered water demand proportioned in the Santa Cruz Mid-County Basin by land use. Private domestic, agricultutal, and institutional groundwater uses are estimated based on land use.",8769,"",5171,0,0,0,3598,407,"private domestic and institutional",0,0,0,0,912,7450,8769,8769,0
"75","53",NA,2020,"SOUTH YUBA","5-021.61","Single Annual Report","Entire Basin","Groundwater extraction is estimated for Urban using data retrieved from the State Water Resources Control Board Water Conservation Portal for Olivehurst Public Utilities District and metered data reported by the Beale Air Force Base, Linda County Water District, and City of Wheatland. Agricultural and Rural Residential groundwater extractions are estimated using the Yuba Groundwater Model (YGM). Agricultural - Groundwater Substitution Transfers is based on metered data reported by the Member Units. Plumas Mutual Water Company - Groundwater Transfers are based on metered data reported by Plumas Mutual Water Company. Surface water is estimated using the YGM and is the amount of surface water diverted to meet agricultural demand. This includes the surface water consumptively used by the crop and the surface water that percolates to the groundwater system as part of the irrigation process. These surface water values differ from diverted amounts in that they do not include conveyance losses and operational flows (the amount diverted at the headgate but not used and spilled at a downstream location).",235220,"",147840,0,0,0,87380,223110,"Rural residential",0,0,0,0,1930,10180,235220,235220,0
"76","",117,2020,"TAHOE SOUTH","6-005.01","Single Annual Report","Entire Basin","Estimated total water produced scaled to water loss and demand estimates from the District’s 2020 Advanced Metering Infrastructure Data, which capture about 97% of the total number of water accounts in the District’s system.",6133,"",6133,0,0,0,0,0,"",915,0,0,0,0,5218,6133,6133,0
"77","43",NA,2020,"TULARE LAKE","5-022.12","Single Annual Report","Entire Basin","Sum of surface water deliveries, groundwater extraction, and effective precipitation.",774527,"",375293,0,0,0,315262,738708,"Rural Domestic",0,0,0,0,8701,27118,774527,690555,-83972
"78","64,65,66,69,70,71",NA,2020,"TULE","5-022.13","Multiple Annual Reports","Entire Basin","Explanations for individual Annual Reports are available on the SGMA Portal (https://sgma.water.ca.gov/portal/gspar/submitted).",1361600,"Explanations for individual Annual Reports are available on the SGMA Portal (https://sgma.water.ca.gov/portal/gspar/submitted).",755720,268600,4020,900,353960,1061600,"Explanations for individual Annual Reports are available on the SGMA Portal (https://sgma.water.ca.gov/portal/gspar/submitted).",0,71400,0,0,0,73150,1134750,1383200,248450
"79","119",NA,2020,"UPPER VENTURA RIVER","4-003.01","Single Annual Report","Entire Basin","Agricultural groundwater estimated based on numerical model inputs, surface water based on direct metered volumes and estimated from purchases, urban groundwater based on reported values from each district, native vegetation calculated using the numerical model.",3499,"",2290,0,0,0,1209,505,"",0,0,0,1200,0,1794,3499,3499,0
"80","67",NA,2020,"WESTSIDE","5-022.09","Single Annual Report","Entire Basin","Groundwater extraction from metered wells and monthly surface water delivery records from USBR",940000,"",400216,0,0,0,539655,934000,"Small water systems (4700 AF) and Domestic wells (82 AF)",0,0,142,0,4782,913,939837,939871,34
"81","80",NA,2020,"YUCAIPA","8-002.07","Single Annual Report","Entire Basin","Groundwater extractions for municipal use are metered using in-line flow propeller and digital totalizers; groundwater extractions via native vegetation are estimated using a numerical model; imported SWP water volumes are purchased and metered on delivery; imported groundwater pumped from outside the Subbasin is metered; recycled water delivery by YVWD is metered; and reused water is treated water from YVRWFF that is discharged to spreading basins. The delivery of the reused water to the spreading basins is metered.",23928,"Imported groundwater from wells operating outside the Plan Area.",13200,1809,2137,0,6782,193,"",0,672,0,4241,0,18822,23256,23928,672
"82","122",NA,2021,"180/400 FOOT AQUIFER","3-004.01","Single Annual Report","Entire Basin","Groundwater extraction data was recieved from MCWRA and were filtered by location for the 180/400 Foot Aquifer Subbasin. The groundwater extraction total is inclusive of rural domestic pumping which was estimated multiplying the approximate number of domestic users by 0.39 AF/yr. Salinas River Diversion Facility (SRDF) Salinas River diversions and recycled water use numbers from from the Salinas Valley Reclamation Project (SVRP) were received from Monterey One Water. Addtional surface water diversions were downloaded from the SWRCB via eWRIMS and were filtered by location for the 180/400 Foot Aquifer Subbasin. Many growers and residents noted that some irrigation is reported both to SWRCB as surface water diversions and to MCWRA as groundwater pumping. To avoid double counting, all surface water reported as a Statement of Diversion and Use are excluded from the total surface water use. In other words, the total surface water use includes the SRDF river diversions, which were 5,100 AF/yr. in WY 2021, and appropriative surface water diversions reported to eWRIMS. In WY 2021, approximately 6,500 AF/yr. of the surface water diversions reported to eWRIMS were were reported as a Statement of Diversion and Use and approximately 700 AF/yr. were reported as Appropriative. The recycled water total is made up of water from SVRP and water from the California American Water Indian Springs Reclamation Facility that is used in California Water Service Salinas Hills Water System. ",145130,"",127000,0,12330,0,5800,132300,"This includes estimated Rural Domestic water use.",0,0,0,0,200,12330,144830,145130,300
"83","141",NA,2021,"ANDERSON","5-006.03","Single Annual Report","Entire Basin","Direct measurement via flowmeters and estimates from EAGSA model.",115774,"",28038,0,0,0,87736,101517,"",0,0,0,1,0,14256,115774,115774,0
"84","83",NA,2021,"ANTELOPE","5-021.54","Single Annual Report","Entire Basin","Groundwater extraction was obtained from modeled results and Application of CVP and local surface water supplies for agricultural uses was quantified by specifying monthly diversions in Tehama IHM. Monthly diversion volumes were summarized or estimated and were then applied to groups of model elements that approximately correspond to the district service area or application area where that water is used. Deliveries were calculated by Tehama IHM as the water supply used to meet simulated crop water demands, after accounting for seepage and evaporation of the diverted supply. The surface water supplies used by native vegetation were calculated within Tehama IHM as the volume of surface water available to meet native vegetation water demand within each element in each month. All surface water supplies used by native vegetation are assumed to be local supplies. There is no noted use of surface water for urban use in the Tehama County subbasins.",35270,"",27460,0,0,0,7810,33810,"",0,0,0,460,0,1000,35270,35270,0
"85","112",NA,2021,"ATASCADERO AREA","3-004.11","Single Annual Report","Entire Basin","Total water use was determined by summing the total groundwater extractions (determined via municpal well meters, estimated agricultural use using land use data and Open ET, and rural domestic and small public water systems using the Paso Robles Groundwater Basin Model) and total surface water use estimated from metered usage of Nacimiento Water Project local imports. ",19800,"",16700,0,0,0,3061,4500,"Public Water System and Rural Domestic",0,0,0,0,1348,13921,19769,19761,-8
"86","96",NA,2021,"BEDFORD-COLDWATER","8-004.02","Single Annual Report","Entire Basin","Flow meters, numerical model",11720,"",4450,0,1188,0,6082,981,"",0,0,0,0,0,10740,11721,11720,-1
"87","101",NA,2021,"BIG VALLEY","5-004","Single Annual Report","Entire Basin","Estimated from water budget model. Use by sector estimated based on historic trends. Relies heavily on assumptions about land use and population trends. Data sourced from DWR Land Use surveys, Precipitation and Evapotranspiration estimated from CIMIS station #43, Streamflow estimated from USGS stream gage 11349000 PIT R NR LOOKOUT CA. ",140400,"",54000,0,0,0,86400,81000,"",0,0,0,59300,0,100,140400,140400,0
"88","100",NA,2021,"BIG VALLEY","5-015","Single Annual Report","Entire Basin","Self-reported data available in the SWRCB Water Rights Information Management System (eWRIMS) were used to estimate annual surface water diversions. Groundwater pumped by public water systems were estimated based on available data in the SWRCB Electronic Annual Report database. Groundwater extraction for self-supplied users was estimated based on land use data and the populations outside of public water system service areas. A flow model was used to estimage groundwater demand for agriculture and groundwater uptake ny natural vegetaion. Groundwater demand for agriculture was estimated based on crop water demand that is not met by precipitation and surface water diversions. Plant water uptake was estimated using vegetation type, climate, availability of shallow groundwater and the rooting depth of plants. ",24800,"",24200,0,0,0,600,14300,"Small water systems and domestic wells",0,0,0,6500,3500,500,24800,24800,0
"89","87",NA,2021,"BOWMAN","5-006.01","Single Annual Report","Entire Basin","Groundwater extraction was obtained from modeled results and Application of CVP and local surface water supplies for agricultural uses was quantified by specifying monthly diversions in Tehama IHM. Monthly diversion volumes were summarized or estimated and were then applied to groups of model elements that approximately correspond to the district service area or application area where that water is used. Deliveries were calculated by Tehama IHM as the water supply used to meet simulated crop water demands, after accounting for seepage and evaporation of the diverted supply. The surface water supplies used by native vegetation were calculated within Tehama IHM as the volume of surface water available to meet native vegetation water demand within each element in each month. All surface water supplies used by native vegetation are assumed to be local supplies. There is no noted use of surface water for urban use in the Tehama County subbasins.",23600,"",9600,0,0,0,14000,20800,"",0,0,0,1500,0,1300,23600,23600,0
"90","92",NA,2021,"BUTTE","5-021.70","Single Annual Report","Entire Basin","Methods used are a combination of estimates based on land use and population/per capita water use, metered municipal/industrial water use, SB88 measurements, and estimates based on historic water rights data for dry and critical years. ",1094400,"",280700,0,0,0,815700,1093600,"Rural Residential (private domestic wells)",0,0,0,0,600,2200,1096400,1096400,0
"91","102",NA,2021,"BUTTE VALLEY","1-003","Single Annual Report","Entire Basin","Methods for groundwater use is the Butte Valley Integrated Hydrologic Model and an estimate based on the Census population in the groundwater basin. Applied surface water is a data gap in WY 2021 and an estimate cannot be determined. Applied water for managed wetland and native vegetation water use sectors is a data gap.",88000,"",88000,0,0,0,0,87600,"",0,0,0,0,0,400,88000,88000,0
"92","127",NA,2021,"CASTAC LAKE VALLEY","5-029","Single Annual Report","Entire Basin","Groundwater is the only supply source within the Basin, so total water use is equal to that of total estimated groundwater extraction. Water year total and monthly groundwater pumping data for the Basin are derived from available reported flowmeter readings between October 2020 and September 2021. Groundwater use data generally are reported by AF, with a precision of 0.001 AF, however some municipal water suppliers report in gallons, with a precision of 1.0 gallon.",334,"",334,0,0,0,0,0,"",0,0,0,0,0,334,334,334,0
"93","133",NA,2021,"CHOWCHILLA","5-022.05","Single Annual Report","Entire Basin","Total Water Use is assumed to be the total volume of water that is applied to land surfaces or that precipitates onto land surfaces. A portion of this water is consumptively ""used"" through evapotranspiration/evaporation. The remaining water is ""used"" to recharge the Subbasin through deep percolation and seepage of runoff.
Groundwater is determined following the methods described in Part B.
Surface water is determined from delivery records (from Districts) and riparian diversion reports (eWRIMS).
Precipitation is determined from PRISM data.",404610,"Precipitation",374360,18820,0,0,11430,392220,"",0,0,0,1050,0,11340,404610,404610,0
"94","135",NA,2021,"COLUSA","5-021.52","Single Annual Report","Entire Basin","Groundwater is determined following the methods described in Part B.
Surface water is determined following the methods described in Part C.
Totals are rounded to nearest TAF, except urban water use which is rounded to nearest 100 AF (substantial meter records).",1895000,"",977000,0,0,0,918000,1782000,"",0,0,103000,0,0,10200,1895200,1895000,-200
"95","90",NA,2021,"CORNING","5-021.51","Single Annual Report","Entire Basin","Estimated agricultural water use from land use map; surface water deliveries are metered in Corning WD and estimated in OUWUA; agricultural groundwater extraction is estimated to make up difference between agricultural water demand and surface water deliveries; groundwater extraction for urban useis metered;  rural residential, industrial, tribal, and small water system groundwater extraction is estimated from per capita water demand and prior reports; GCID groundwater extraction for irrigation supply in Colusa Subbasin is metered.  ",269400,"",257200,0,0,0,12300,264600,"Rural Residential",1500,0,0,0,250,3000,269350,269500,150
"96","109",NA,2021,"COSUMNES","5-022.16","Single Annual Report","Entire Basin","All water source types represented by a combination of metered, reported, and estimated uses.",175800,"",149300,0,1300,0,25200,156600,"",11000,0,0,0,0,8200,175800,175800,0
"97","107",NA,2021,"CUYAMA VALLEY","3-013","Single Annual Report","Entire Basin","Water budgets in the Cuyama Basin GSP were developed using the Cuyama Basin Water Resources Model (CBWRM) model, which is a fully integrated surface and groundwater flow model covering the Basin. The CBWRM was used to develop a historical water budget that evaluated the availability and reliability of past surface water supply deliveries, aquifer response to water supply, and demand trends relative to water year type. For the past three Annual Reports, the CBWRM model was extended to include the 2018 through 2021 water years, utilizing updated land use, temperature, and precipitation  data from those years. ",59300,"",59300,0,0,0,0,59000,"",0,0,0,0,0,300,59300,59300,0
"98","113",NA,2021,"DELTA-MENDOTA","5-022.07","Single Annual Report","Entire Basin","Sum of self-reported volumes from each GSA within the Delta-Mendota Subbasin across six Subbasin GSP regions; Reflects water lost through canal leakage, pipe leakage, and other percolating waters",1583300,"Imported Recycled Water Surface Storage reported from the North Valley Regional Recycled Water Project by Del Puerto Water District, stored in San Luis Reservoir",438400,9700,9300,16100,1109800,1238400,"Imported Recycled Water Surface Storage reported from the North Valley Regional Recycled Water Project by Del Puerto Water District, stored in San Luis Reservoir",3200,0,314900,0,9700,17100,1583300,1583300,0
"99","117",NA,2021,"EAST BAY PLAIN","2-009.04","Single Annual Report","Entire Basin","Metered surface water data reported by local agencies was used to determine the volume of surface water supply. Groundwater extraction was estimated based on previous estimates of pumping developed by Muir (1996), WRIME (2005), and EBMUD (2018) as documented in the GSP.",100001,"",3900,0,3001,0,93100,0,"",17681,0,0,300,0,82020,100001,100001,0
"100","137",NA,2021,"EAST CONTRA COSTA","5-022.19","Single Annual Report","Entire Basin","East Contra Costa Groundwater-Surface Water Simulation Model (ECCSim) developed for the ECC GSP was used to estimate the Basin's water budget. Groundwater demand for agriculture was estimated based on crop water demand that is not met with reported surface water diversions and metered groundwater. City and Irrigation district groundwater wells were metered. Considered reported domestic wells and PWS in the Subbasin and estimated a pumping amount from report values in SWRCB and and annual use per well. Monthly self reported surface water diversions. ",229219,"",42094,0,1084,0,186040,193170,"",0,0,0,0,0,33665,226835,229218,2383
"101","131",NA,2021,"EAST SIDE AQUIFER","3-004.02","Single Annual Report","Entire Basin","Groundwater extraction data were received from MCWRA and filtered by location for the Eastside Aquifer Subbasin. The same process was followed for surface water diversions downloaded from the SWRCB via eWRIMS. Many growers and residents noted that some irrigation is reported both to SWRCB as surface water diversions and to MCWRA as groundwater pumping. To avoid double counting, all surface water reported as a Statement of Diversion and Use are excluded from the total surface water use. In WY 2021, approximately 400 AF/yr. of the surface water diversions reported to eWRIMS were reported as a Statement of Diversion and Use and no other surface water use was reported.",82000,"",82000,0,0,0,0,68800,"",0,0,0,0,0,13200,82000,82000,0
"102","86",NA,2021,"EASTERN SAN JOAQUIN","5-022.01","Single Annual Report","Entire Basin","Total water use is the sum of groundwater use (Part A) and surface water use (Part C).",1383924,"",809327,0,0,0,574597,1269126,"",0,0,0,0,0,144799,1413925,1383924,-30001
"103","174",NA,2021,"EEL RIVER VALLEY","1-010","Single Annual Report","Entire Basin","Meters and Land Use",18096,"",17188,0,0,0,908,14848,"Cannabis irrigation and domestic rural",34,0,0,0,512,2702,18096,18096,0
"104","154",NA,2021,"ELSINORE VALLEY","8-004.01","Single Annual Report","Entire Basin","Calculated the total from each water source and total water applied to water use sector from measured metered data collected by EVMWD",30919,"",4147,0,7791,0,18954,336,"",0,0,6455,0,0,24128,30919,30892,-27
"105","142",NA,2021,"ENTERPRISE","5-006.04","Single Annual Report","Entire Basin","Direct measurement via flowmeters and estimates from EAGSA model.",61219,"",22089,0,0,0,39130,30973,"",0,0,0,1,0,30245,61219,61219,0
"106","116",NA,2021,"FILLMORE","4-004.05","Single Annual Report","Entire Basin","Domestic, Electrical Efficiency, Water Meter, Weir, Estimated from previously reported diversions",56889,"",56787,0,0,0,102,54263,"",0,0,0,0,0,2626,56889,56889,0
"107","128",NA,2021,"FOREBAY AQUIFER","3-004.04","Single Annual Report","Entire Basin","Groundwater extraction data were received from MCWRA and filtered by location for the Forebay Aquifer Subbasin. The same process was followed for surface water diversions downloaded from the SWRCB via eWRIMS. Many growers and residents noted that some irrigation is reported both to SWRCB as surface water diversions and to MCWRA as groundwater pumping. To avoid double counting, all surface water reported as a Statement of Diversion and Use are excluded from the total surface water use, except that diverted by Clark Colony Water Company (CCWC). In other words, the total surface water use includes only the CCWC diversions, which were approximately 1,500 AF/yr. in WY 2021, and appropriative surface water diversions reported to eWRIMS. In WY 2021, approximately 16,400 AF/yr. of the surface water diversions reported to eWRIMS were reported as a Statement of Diversion and Use (inclusive of CCWC's diversion) and 0 AF/yr. were reported as Appropriative.",151900,"",150400,0,0,0,1500,144300,"",0,0,0,0,0,7600,151900,151900,0
"108","160",NA,2021,"INDIAN WELLS VALLEY","6-054","Single Annual Report","Entire Basin","Water meters, electrical meters, population estimates, land use estimates, other estimates",22100,"",20800,0,1300,0,0,9010,"Other includes Federal Use: (1,770 AF), Domestic/Mutual/Co-Ops: (1,420 AF), and recycled water percolation/habitat support (790 AF).",2180,0,0,0,3980,6930,22100,22100,0
"109","",54,2021,"INDIO","7-021.01","Single Annual Report","Entire Basin","99% metered, 1% estimated",582755,"Colorado River Water",283163,284874,14000,0,719,292767,"Other category refers to the unmetered groundwater pumping for domestic uses. Includes only water use in the Subbasin",1288,0,0,0,1500,287201,582756,582756,0
"110","171",NA,2021,"KAWEAH","5-022.11","Single Annual Report","Entire Basin","Sum of groundwater use plus water supplies minus conveyance losses",1120800,"",1036600,0,12300,0,82900,949700,"",21800,5800,0,400,0,64600,1036500,1131800,95300
"111","146",NA,2021,"KERN COUNTY","5-022.14","Single Annual Report","Entire Basin","Meters, Land Use Calculations, Groundwater Model",3267023,"",2471156,0,51926,121,774033,2467092,"Banking Recovery, exchanges and pumpins",0,74887,18036,0,491137,215870,3192135,3297236,105101
"112","155",NA,2021,"KINGS","5-022.08","Single Annual Report","Entire Basin","Sum of all water supplies",2628101,"Riparian water diversions",2293436,30099,9252,0,295314,2317832,"JID Wells Pumped in McMullin GSA",0,21601,0,0,42310,246358,2606500,2628101,21601
"113","129",NA,2021,"LANGLEY AREA","3-004.09","Single Annual Report","Entire Basin","Groundwater extraction and recycled water use numbers were received from MCWRA and filtered by location for the Langley Area Subbasin. The same process was followed for surface water but Salinas River diversions were downloaded from the SWRCB via eWRIMS. In WY 2021, no surface water diversions of any kind were reported to eWRIMS.",1460,"",1460,0,0,0,0,90,"Rural domestic pumping in the Langley Subbasin is estimated by applying a constant rate of 0.3 acre-feet per year (AF/yr.) to all non-vacant residential use parcels that are not located in the service area of a public drinking water system. Based on a review of available data, there are approximately 2,016 non-vacant residential use parcels units located outside the service areas of public drinking water systems in the Subbasin.",0,0,0,0,600,770,1460,1460,0
"114","106",NA,2021,"LAS POSAS VALLEY","4-008","Single Annual Report","Entire Basin","meters, reported sales",49570,"",38762,0,1244,0,9564,36860,"domestic",0,0,0,0,124,12586,49570,49570,0
"115","",55,2021,"LIVERMORE VALLEY","2-010","Single Annual Report","Entire Basin","Sum of groundwater, surface water, and recycled water.",58635,"",22747,0,8215,0,27673,6454,"Golf",0,235,0,0,269,51912,58635,58635,0
"116","",59,2021,"LLAGAS AREA","3-003.01","Single Annual Report","Entire Basin","Metered (most use) or estimated using table of average uses or crop factors (estimated groundwater use). Note - Industrial use for all water sources except recycled water is grouped with municipal use under Urban water use sector. The distribution of 2,200 AF of recycled water in the various water use sectors is based on the distribution ratio from 2020 data because the 2021 data is not available yet.",46400,"",43600,0,2200,0,600,25280,"",1070,17200,0,0,0,20050,46400,46400,0
"117","88",NA,2021,"LOS MOLINOS","5-021.56","Single Annual Report","Entire Basin","Groundwater extraction was obtained from modeled results and Application of CVP and local surface water supplies for agricultural uses was quantified by specifying monthly diversions in Tehama IHM. Monthly diversion volumes were summarized or estimated and were then applied to groups of model elements that approximately correspond to the district service area or application area where that water is used. Deliveries were calculated by Tehama IHM as the water supply used to meet simulated crop water demands, after accounting for seepage and evaporation of the diverted supply. The surface water supplies used by native vegetation were calculated within Tehama IHM as the volume of surface water available to meet native vegetation water demand within each element in each month. All surface water supplies used by native vegetation are assumed to be local supplies. There is no noted use of surface water for urban use in the Tehama County subbasins.",76490,"",43490,0,0,0,33000,73000,"",0,0,0,2500,0,990,76490,76490,0
