"","GSPAR_IDS","ALTAR_ID","REPORT_YEAR","BASIN_NAME","SUBBASIN_NUMBER","SINGLE_MULTIPLE_AR","ANNUAL_REPORT_AREA","METHOD_USED","TOTAL_WATER_USE","WST_EXPLANATION","WST_GROUNDWATER","WST_OTHER","WST_RECYCLED_WATER","WST_REUSED_WATER","WST_SURFACE_WATER","WUS_AGRICULTURAL","WUS_EXPLANATION","WUS_INDUSTRIAL","WUS_MANAGED_RECHARGE","WUS_MANAGED_WETLANDS","WUS_NATIVE_VEGETATION","WUS_OTHER","WUS_URBAN","sum_used_up","total_water_and_other","total"
"1","",106,2017,"INDIO","7-021.01","Single Annual Report","Entire Basin","99% metered, 1% estimated",868401,"Colorado River Water",266247,589529,10724,0,1901,297227,"Other category refers to the unmetered groundwater pumping for domestic uses. Includes only water use in the Subbasin.",1419,0,0,0,1500,263023,563169,868401,305232
"2","",92,2017,"LIVERMORE VALLEY","2-010","Single Annual Report","Entire Basin","Sum of groundwater, surface water, and recycled water.",48930,"",10363,0,6241,0,32326,4549,"",0,9615,0,0,0,44383,48932,48930,-2
"3","",108,2017,"LLAGAS AREA","3-003.01","Single Annual Report","Entire Basin","Metered (most use) or estimated using table of average uses or crop factors (estimated groundwater use). The distribution of 1800 AF of recycled water in the various water use sectors is based on the distribution ratio from 2020 data. Note - Industrial use for all water sources except recycled water is grouped with municipal use under Urban water use sector because we don't have data to distinguish between municipal and industrial use.",44000,"",41100,0,1800,0,1100,23987,"",873,17898,0,0,0,19140,44000,44000,0
"4","",152,2017,"MISSION CREEK","7-021.02","Single Annual Report","Entire Basin","Metered wells and estimate of unmetered well use based on population in areas outside of municipal water service areas. Imported surface water used for groundwater replenishment metered Colorado River Aqueduct Water.",16039,"Imported Groundwater from Adjacent Subbasins",13782,309,0,0,1948,614,"Undetermined but estimated to be mostly urban use by minimal pumpers who are not required to report producton to Coachella Valley Water District  (<25 AFY) or to Desert Water Agency (<10 AFY).",261,0,0,0,500,12716,14091,16039,1948
"5","",94,2017,"NILES CONE","2-009.01","Single Annual Report","Entire Basin","Water Use is metered or gaged by Agency and/or Water Source Type. ACWD sources include local surface water from the Alameda Creek Watershed (measured by stream gage), extracted groundwater (with non-ACWD wells metered through the Replenishment Assessment Program), SWP (metered), SFPUC (metered), Lake Del Valle (metered), and Semitropic Water Storage District (metered). Local surface water from the Alameda Creek Watershed, as well as some SWP and Semitropic Water Storage District water, was used for managed aquifer recharge, which is recovered as groundwater pumping and other groundwater demands. Therefore, the numerical Total Water Use (71896 AF) is not a net water supply value. Water Use by Non-ACWD Owned/Operated Wells and the City of Hayward Distribution System (via SFPUC) are also metered.",71896,"Includes water imported from the SWP (8,048 AF), SFPUC (8,125 AF), Lake Del Valle (7,848 AF), Semitropic Water Storage District (276 AF), and the City of Hayward Distribution System (via SFPUC) (1,137 AF). Note that some SWP and Semitropic Water Storage District water was used for managed aquifer recharge, which is recovered as groundwater pumping and other groundwater demands.",20693,25434,3803,0,21965,127,"""Non-Revenue Water"" (3,751 AF), ""Desal to SF Bay"" (2,958 AF), and ""ARP"" (536 AF) were added as Water Use Sectors to account for water that could not be appropriately categorized under SGMA water use sectors. ""Non-Revenue Water"" is the amount of water supplied to the ACWD distribution system less the summation of meter readings for which customers were billed. Non-Revenue Water includes non-billed consumption (fire flows, distribution system flushing, etc.) plus real and apparent losses. ""Desal to SF Bay"" is brine and brine dilution water discharged from the Desalination Facility as wastewater and discharged to San Francisco Bay. ""ARP"" is the Aquifer Reclamation Program. Groundwater classified under ""ARP"" is water extracted to improve basin water quality, but is not supplied to the Desalination Facility for potable reuse.",4806,21965,3803,0,7245,33950,49931,71895,21964
"6","",110,2017,"PAJARO VALLEY","3-002.01","Single Annual Report","Entire Basin","Total water use in the Pajaro Valley Basin during water year 2017 was 48,794 acre-feet. Surface water supply use is measured through direct measurement by flow meters that have an accuracy of +/- 1.5 % or estimated using a mass balance approach and measurement of inflows. Metered groundwater use is measured through direct measurement by flow meters that have an accuracy of +/- 5.0 %. For non-metered commercial production facilities, average annual demand is based off the adopted estimated annual water demand rates for the following land uses: residential (0.5 acre-feet per year [AFY] per dwelling unit), apple orchard (1.0 AFY per cultivated acre), greenhouse operation (4.0 AFY per cultivated acre), mushroom operation (1.5 AFY per 100 tons of mushrooms produced), golf course and other turf (3.2 AFY per acre), non-irrigated agriculture (0.0 AFY per acre), all other agriculture (2.5 AFY per cultivated acre), and all other commercial operations (1.5 AFY per 1.0 acre-feet of wastewater produced). If a non-metered commercial water production facility serves more than one land use, total annual water production of the facility shall be estimated as the sum of all such uses on the prorated basis of the indices established above. Total annual demand shall be presumed to be evenly divided between the period of January through June and the period of July through December. The annual water demand of a water production facility located on residential land and used for residential purposes only is estimated at 0.5 acre-feet per year per dwelling unit served. This demand is based on average annual water use data from rural residential water providers Aromas Water District, Central Water District, and San Andreas Mutual Water Company.",48794,"The Harkins Slough Managed Aquifer Recharge and Recovery Facility diverts surface water from Harkins Slough and conveys it to a recharge basin where it percolates into the surficial aquifer of the San Andreas Terrace located near the coast. PV Water utilizes a series of wells to recover recharged water and delivers it to coastal farms through the Coastal Distribution System.",44892,281,2429,0,1192,38293,"Rural Residential - Unmetered residential water users in rural settings",779,823,0,0,1459,7440,47971,48794,823
"7","",107,2017,"SANTA CLARA","2-009.02","Single Annual Report","Entire Basin","Metered (most use) or estimated using table of average uses or crop factors (estimated groundwater use). Note - Industrial use for all water sources except recycled water is grouped with municipal use under Urban water use sector. The distribution of 15000 AF of recycled water in the various water use sectors is based on the distribution ratio from 2020 data.",238500,"",74200,0,15000,0,149300,3254,"",6270,78871,0,0,0,228976,238500,238500,0
"8","",123,2017,"TAHOE SOUTH","6-005.01","Single Annual Report","Entire Basin","Estimated total water produced scaled to water loss and demand estimates from 2015 STPUD Urban Water Management Plan (J. Crowley Group, 2016).",6514,"",6514,0,0,0,0,0,"",2708,0,0,0,0,3806,6514,6514,0
"9","",171,2018,"INDIO","7-021.01","Single Annual Report","Entire Basin","99% metered, 1% estimated",594339,"Colorado River Water",288308,292336,14188,0,1797,309859,"Other category refers to the unmetered groundwater pumping for domestic uses. Includes only water use in the Subbasin.",1522,0,0,0,1500,281458,594339,596629,2290
"10","",115,2018,"LIVERMORE VALLEY","2-010","Single Annual Report","Entire Basin","Sum of groundwater, surface water, and recycled water.",52938,"",11545,0,6731,0,34662,5333,"",0,6773,0,0,0,47605,52938,52938,0
"11","",167,2018,"LLAGAS AREA","3-003.01","Single Annual Report","Entire Basin","Metered (most use) or estimated using table of average uses or crop factors (estimated groundwater use). The distribution of 2200 AF of recycled water in the various water use sectors is based on the distribution ratio from 2020 data. Note - Industrial use for all water sources except recycled water is grouped with municipal use under Urban water use sector because we don't have data to distinguish between municipal and industrial use.",46100,"",42600,0,2200,0,1300,24735,"",1067,20300,0,0,0,20298,46100,46100,0
"12","",172,2018,"MISSION CREEK","7-021.02","Single Annual Report","Entire Basin","Metered wells and estimate of unmetered well use based on population in areas outside of municipal water service areas. Imported surface water used for groundwater replenishment metered Colorado River Aqueduct Water.",14742,"Imported Groundwater from Adjacent Subbasin",14573,169,0,0,0,611,"Undetermined but estimated to be mostly urban use by minimal pumpers who are not required to report producton to Coachella Valley Water District  (<25 AFY) or to Desert Water Agency (<10 AFY).",262,0,0,0,500,13369,14742,14742,0
"13","",116,2018,"NILES CONE","2-009.01","Single Annual Report","Entire Basin","Water Use is metered or gaged by Agency and/or Water Source Type. ACWD sources include local surface water from the Alameda Creek Watershed (measured by stream gage), extracted groundwater (with non-ACWD wells metered through the Replenishment Assessment Program), SWP (metered), SFPUC (metered), Lake Del Valle (metered), and Semitropic Water Storage District (metered). Local surface water from the Alameda Creek Watershed, as well as some SWP and Semitropic Water Storage District water, was used for managed aquifer recharge, which is recovered as groundwater pumping and other groundwater demands. Therefore, the numerical Total Water Use (70725 AF) is not a net water supply value. Water Use by Non-ACWD Owned/Operated Wells and the City of Hayward Distribution System (via SFPUC) are also metered.",70725,"Includes water imported from the SWP (13,126 AF), SFPUC (8,085 AF), Lake Del Valle (1,110 AF), Semitropic Water Storage District (4,276 AF), and the City of Hayward Distribution System (via ) (1,272 AF). Note that some SWP and Semitropic Water Storage District water was used for managed aquifer recharge, which is recovered as groundwater pumping and other groundwater demands.",20636,27869,3471,0,18748,120,"""Non-Revenue Water"" (3,418 AF), ""Desal to SF Bay"" (3,290 AF), and ""ARP"" (475 AF) were added as Water Use Sectors to account for water that could not be appropriately categorized under SGMA water use sectors. ""Non-Revenue Water"" is the amount of water supplied to the ACWD distribution system less the summation of meter readings for which customers were billed. Non-Revenue Water includes non-billed consumption (fire flows, distribution system flushing, etc.) plus real and apparent losses. ""Desal to SF Bay"" is brine and brine dilution water discharged from the Desalination Facility as wastewater and discharged to San Francisco Bay. ""ARP"" is the Aquifer Reclamation Program. Groundwater classified under ""ARP"" is water extracted to improve basin water quality, but is not supplied to the Desalination Facility for potable reuse.",5199,18748,3471,0,7183,36005,51978,70724,18746
"14","",174,2018,"PAJARO VALLEY","3-002.01","Single Annual Report","Entire Basin","Total water use in the Pajaro Valley Basin during water year 2018 was 54,375 acre-feet. Surface water supply use is measured through direct measurement by flow meters that have an accuracy of +/- 1.5 % or estimated using a mass balance approach and measurement of inflows. Metered groundwater use is measured through direct measurement by flow meters that have an accuracy of +/- 5.0 %. For non-metered commercial production facilities, average annual demand is based off the adopted estimated annual water demand rates for the following land uses: residential (0.5 acre-feet per year [AFY] per dwelling unit), apple orchard (1.0 AFY per cultivated acre), greenhouse operation (4.0 AFY per cultivated acre), mushroom operation (1.5 AFY per 100 tons of mushrooms produced), golf course and other turf (3.2 AFY per acre), non-irrigated agriculture (0.0 AFY per acre), all other agriculture (2.5 AFY per cultivated acre), and all other commercial operations (1.5 AFY per 1.0 acre-feet of wastewater produced). If a non-metered commercial water production facility serves more than one land use, total annual water production of the facility shall be estimated as the sum of all such uses on the prorated basis of the indices established above. Total annual demand shall be presumed to be evenly divided between the period of January through June and the period of July through December. The annual water demand of a water production facility located on residential land and used for residential purposes only is estimated at 0.5 acre-feet per year per dwelling unit served. This demand is based on average annual water use data from rural residential water providers Aromas Water District, Central Water District, and San Andreas Mutual Water Company.",54375,"The Harkins Slough Managed Aquifer Recharge and Recovery Facility diverts surface water from Harkins Slough and conveys it to a recharge basin where it percolates into the surficial aquifer of the San Andreas Terrace located near the coast. PV Water utilizes a series of wells to recover recharged water and delivers it to coastal farms through the Coastal Distribution System.",50218,225,3274,0,658,44151,"Rural Residential - Unmetered residential water users in rural settings",1056,73,0,0,1397,7697,54301,54375,74
"15","",173,2018,"SANTA CLARA","2-009.02","Single Annual Report","Entire Basin","Metered (most use) or estimated using table of average uses or crop factors (estimated groundwater use). Note - Industrial use for all water sources except recycled water is grouped with municipal use under Urban water use sector. The distribution of 15600 AF of recycled water in the various water use sectors is based on the distribution ratio from 2020 data.",247900,"",79600,0,15600,0,152700,3780,"",6521,98400,0,0,0,237599,247900,247900,0
"16","",158,2018,"TAHOE SOUTH","6-005.01","Single Annual Report","Entire Basin","Estimated total water produced scaled to water loss and demand estimates from 2015 STPUD Urban Water Management Plan (J. Crowley Group, 2016)",6833,"",6833,0,0,0,0,0,"",2840,0,0,0,0,3992,6832,6833,1
"17","21",NA,2019,"180/400 FOOT AQUIFER","3-004.01","Single Annual Report","Entire Basin","Groundwater extraction data was recieved from MCWRA and were filtered by location for the 180/400 Foot Aquifer Subbasin. The groundwater extraction total is inclusive of rural domestic pumping which was estimated multiplying the approximate number of domestic users by 0.39 AF/yr. Salinas River Diversion Facility (SRDF) Salinas River diversions and recycled water use numbers from from the Salinas Valley Reclamation Project (SVRP) were received from Monterey One Water. Addtional surface water diversions were downloaded from the SWRCB via eWRIMS and were filtered by location for the 180/400 Foot Aquifer Subbasin. Many growers and residents noted that some irrigation is reported both to SWRCB as surface water diversions and to MCWRA as groundwater pumping. To avoid double counting, all surface water reported as a Statement of Diversion and Use are excluded from the total surface water use. In other words, the total surface water use includes the SRDF river diversions, which were 7,600 AF/yr. in WY 2019, and appropriative surface water diversions reported to eWRIMS. In WY 2019, approximately 7,400 AF/yr. of the surface water diversions reported to eWRIMS were were reported as a Statement of Diversion and Use and none were reported as Appropriative. The recycled water total is made up of water from SVRP. ",133900,"",117800,0,8500,0,7600,121200,"This includes estimated Rural Domestic water use.",0,0,0,0,200,12500,133900,133900,0
"18","144",NA,2019,"BIG VALLEY","5-004","Single Annual Report","Entire Basin","Estimated from water budget model. Use by sector estimated based on historic trends. Relies heavily on assumptions about land use and population trends. Data sourced from DWR Land Use surveys, Precipitation and Evapotranspiration estimated from CIMIS station #43, Streamflow estimated from USGS stream gage 11349000 PIT R NR LOOKOUT CA. ",108400,"",38400,0,0,0,70000,57400,"",0,0,0,50900,0,100,108400,108400,0
"19","10",NA,2019,"CHOWCHILLA","5-022.05","Single Annual Report","Entire Basin","Total Water Use is assumed to be the total volume of water applied to the land surface from all sources.
Groundwater is determined following the methods described in Part B.
Surface water is determined from delivery records (from Districts) and riparian diversion reports (eWRIMS).
Precipitation is determined from CIMIS and PRISM records (PRISM in water year 2019).",522550,"Precipitation",209970,137690,0,0,174890,489700,"",0,8840,0,7370,0,16640,513710,522550,8840
"20","13",NA,2019,"CUYAMA VALLEY","3-013","Single Annual Report","Entire Basin","Water budgets, including groundwater extractions, in the Cuyama Basin GSP were developed using the Cuyama Basin Water Resources Model (CBWRM) model, which is a fully integrated surface and groundwater flow model covering the Basin. The CBWRM integrates the groundwater aquifer with the surface hydrologic system and land surface processes and operations.  The CBWRM was used to develop a historical water budget that evaluated the availability and reliability of past surface water supply deliveries, aquifer response to water supply, and demand trends relative to water year type. For the GSP, the CBWRM was used to develop water budget estimates for the hydrologic period of 1998 through 2017. As discussed in the GSP, the model was developed based on the best available data and information as of June 2018. An assessment of model uncertainty included in the GSP estimated an error range in overall model results of about +/- 10%. It is expected that the model will be refined in the future as improved and updated monitoring information becomes available for the Basin. For the Annual Report, the CBWRM model was extended to include the 2018 and 2019 water years, utilizing updated land use, temperature and precipitation data from those years. No surface water was used in the Cuyama Basin during the reporting period.",47200,"",47200,0,0,0,0,46900,"",0,0,0,0,0,300,47200,47200,0
"21","8",NA,2019,"DELTA-MENDOTA","5-022.07","Single Annual Report","Entire Basin","Sum of self-reported volumes from each GSA within the Delta-Mendota Subbasin across six Subbasin GSP regions; Reflects water lost through canal leakage, pipe leakage, and other percolating waters",1653800,"",256500,0,14400,17800,1365100,1259300,"",6200,7300,365500,0,0,15500,1646500,1653800,7300
"22","14",NA,2019,"EASTERN SAN JOAQUIN","5-022.01","Single Annual Report","Entire Basin","Total water use is the sum of groundwater use (Part A) and surface water use (Part C).",1254591,"",738147,0,0,0,516444,1134479,"",0,0,0,0,0,120111,1254590,1254591,1
"23","40",NA,2019,"INDIAN WELLS VALLEY","6-054","Single Annual Report","Entire Basin","Water meters, electrical meters, population estimates, land use estimates, other estimates",24090,"",22810,0,1280,0,0,11050,"Other includes Federal Use: (1,460 AF), Domestic/Mutual/Co-Ops: (1,380 AF), and recycled water percolation/habitat support (800 AF).",2690,0,0,0,3640,6710,24090,24090,0
"24","",165,2019,"INDIO","7-021.01","Single Annual Report","Entire Basin","99% metered, 1% estimated",551445,"Colorado River Water",261151,274216,14446,0,1632,283551,"Other category refers to the unmetered groundwater pumping for domestic uses. Includes only water use in the Subbasin.",1307,0,0,0,1500,265087,551445,551445,0
"25","29",NA,2019,"KAWEAH","5-022.11","Single Annual Report","Entire Basin","Sum of groundwater use plus water supplies minus conveyance losses",1377700,"",686300,0,12000,0,871800,603900,"",21800,236900,0,590,0,60000,686290,1570100,883810
"26","9",NA,2019,"KERN COUNTY","5-022.14","Single Annual Report","Entire Basin","Meters, Land Use Calculations, Groundwater Model",3878302,"",1284183,0,35609,1524,2768267,2445679,"Banking recovery, exchanges and pumpins",0,1173060,23074,0,36512,199977,2705242,4089583,1384341
"27","26",NA,2019,"KINGS","5-022.08","Single Annual Report","Entire Basin","Sum of all water supplies",2700756,"Riparian water diversions and local minor water transfers",1061594,40172,581,0,1598409,2078777,"James ID Wells pumped in McMullin Area GSA (agricultural use)",0,381436,0,0,7798,232745,2319320,2700756,381436
"28","32",NA,2019,"LAS POSAS VALLEY","4-008","Single Annual Report","Entire Basin","meters, reported sales",29225,"",20355,0,823,0,8047,20435,"rural domestic ",0,0,0,0,37,8753,29225,29225,0
"29","",140,2019,"LIVERMORE VALLEY","2-010","Single Annual Report","Entire Basin","Sum of groundwater, surface water, and recycled water.",51804,"",14021,0,6185,0,31598,4693,"",0,2943,0,0,0,46995,51688,51804,116
"30","",100,2019,"LLAGAS AREA","3-003.01","Single Annual Report","Entire Basin","Metered (most use) or estimated using table of average uses or crop factors (estimated groundwater use). The distribution of 1900 AF of recycled water in the various water use sectors is based on the distribution ratio from 2020 data. Note - Industrial use for all water sources except recycled water is grouped with municipal use under Urban water use sector because we don't have data to distinguish between municipal and industrial use.",45600,"",42400,0,1900,0,1300,24735,"",922,23000,0,0,0,19943,45600,45600,0
"31","20,22,25,33",NA,2019,"MADERA","5-022.06","Multiple Annual Reports","Entire Basin","Explanations for individual Annual Reports are available on the SGMA Portal (https://sgma.water.ca.gov/portal/gspar/submitted).",932101,"Explanations for individual Annual Reports are available on the SGMA Portal (https://sgma.water.ca.gov/portal/gspar/submitted).",435012,309490,46,0,187453,748656,"Explanations for individual Annual Reports are available on the SGMA Portal (https://sgma.water.ca.gov/portal/gspar/submitted).",0,11657,0,76360,0,66795,891811,932001,40190
"32","12",NA,2019,"MERCED","5-022.04","Single Annual Report","Entire Basin","Total water use is a simple sum (by sector) of the groundwater use and total surface water available for use. Groundwater use was calculated by a mixture of direct metered measurements and estimates from the MercedWRM. Surface water diversions were metered directly.",1159302,"",637804,0,0,0,521498,1098340,"",0,0,12495,0,0,48467,1159302,1159302,0
"33","",126,2019,"MISSION CREEK","7-021.02","Single Annual Report","Entire Basin","Metered wells and estimate of unmetered well use based on population in areas outside of municipal water service areas. Imported surface water used for groundwater replenishment metered Colorado River Aqueduct Water.",13868,"Imported Groundwater from Adjacent Subbasin",13782,86,0,0,0,638,"Undetermined but estimated to be mostly urban use by minimal pumpers who are not required to report producton to Coachella Valley Water District  (<25 AFY) or to Desert Water Agency (<10 AFY).",331,0,0,0,500,12399,13868,13868,0
"34","",99,2019,"NILES CONE","2-009.01","Single Annual Report","Entire Basin","Water Use is metered or gaged by Agency and/or Water Source Type. ACWD sources include local surface water from the Alameda Creek Watershed (measured by stream gage), extracted groundwater (with non-ACWD wells metered through the Replenishment Assessment Program), SWP (metered), SFPUC (metered), Lake Del Valle (metered), and Semitropic Water Storage District (metered). Local surface water from the Alameda Creek Watershed, as well as some SWP and Semitropic Water Storage District water, was used for managed aquifer recharge, which is recovered as groundwater pumping and other groundwater demands. Therefore, the numerical Total Water Use (72996 AF) is not a net water supply value. Water Use by Non-ACWD Owned/Operated Wells and the City of Hayward Distribution System (via SFPUC) are also metered.",72996,"Includes water imported from the SWP (8,548 AF), SFPUC (8,868 AF), Lake Del Valle (9,228 AF), Semitropic Water Storage District (733 AF), and the City of Hayward Distribution System (via SFPUC) (1,244 AF). Note that some SWP and Semitropic Water Storage District water was used for managed aquifer recharge, which is recovered as groundwater pumping and other groundwater demands.",19885,28621,2935,0,21555,106,"""Non-Revenue Water"" (4,801 AF), ""Desal to SF Bay"" (3,198 AF), and ""ARP"" (797 AF) were added as Water Use Sectors to account for water that could not be appropriately categorized under SGMA water use sectors. ""Non-Revenue Water"" is the amount of water supplied to the ACWD distribution system less the summation of meter readings for which customers were billed. Non-Revenue Water includes non-billed consumption (fire flows, distribution system flushing, etc.) plus real and apparent losses. ""Desal to SF Bay"" is brine and brine dilution water discharged from the Desalination Facility as wastewater and discharged to San Francisco Bay. ""ARP"" is the Aquifer Reclamation Program. Groundwater classified under ""ARP"" is water extracted to improve basin water quality, but is not supplied to the Desalination Facility for potable reuse.",4537,21785,2935,0,8796,34837,51211,72996,21785
